{
  "schema_version": "qe_microarchitecture_catalog_v0",
  "catalog_id": "qe_microarchitecture_catalog_v0",
  "description": "Broad QE band-solver microarchitecture catalog for evidence-plane v1 Level-1 search. Entries are provenance-backed survey/projection inputs only; catalog membership never creates a final-best claim.",
  "evidence_tier_labels": [
    "survey-catalog",
    "projection-screened",
    "systemc-cycle-accounted",
    "final-best-eligible"
  ],
  "support_status_values": [
    "unsupported",
    "projection_only",
    "systemc_configurable",
    "current_executor_supported"
  ],
  "non_claims": [
    "catalog_entries_are_not_final_best_candidates",
    "catalog_entries_do_not_claim_rtl_cycle_accuracy",
    "catalog_entries_do_not_claim_board_or_asic_measurement",
    "catalog_entries_do_not_claim_gpu_superiority"
  ],
  "entries": [
    {
      "microarchitecture_id": "tensor_systolic_dense_path",
      "name": "Tensor-systolic dense path",
      "target_stage": "operator_sweep",
      "architecture_family": "F3",
      "summary": "Device-heavy systolic tensor fabric hypothesis for h_psi/s_psi dense-block pressure and high arithmetic intensity cases.",
      "provenance": [
        {
          "source_id": "template:f3_tensor_systolic_fpga_offload_v1",
          "source_type": "local_design_template",
          "title": "F3 tensor systolic FPGA offload scaffold",
          "ref": "docs/architecture/architecture_templates/f3_tensor_systolic_fpga_offload_v1.json",
          "notes": "Local scaffold documents the candidate family and projection knobs."
        },
        {
          "source_id": "pattern:systolic_array",
          "source_type": "literature_pattern",
          "title": "Systolic array dataflow pattern",
          "ref": "architecture literature pattern: spatially pipelined matrix/tensor array",
          "notes": "Used only as a survey/projection pattern, not as measured evidence."
        }
      ],
      "assumptions": [
        "Dense small-block operations can be batched into a regular spatial dataflow.",
        "Host/runtime overhead and fallback remain visible in downstream B4 evidence.",
        "No final-best claim is possible without same-candidate Stage C, strict B4, Stage D, and SystemC cycle evidence."
      ],
      "parameter_ranges": {
        "tile_m": {"kind": "range", "min": 8, "max": 64, "unit": "matrix_rows", "description": "Candidate systolic tile rows for projection sweeps."},
        "tile_n": {"kind": "range", "min": 8, "max": 64, "unit": "matrix_cols", "description": "Candidate systolic tile columns for projection sweeps."},
        "accumulator_precision": {"kind": "enum", "values": ["fp64", "mixed_fp64_accumulate"], "description": "Projection-only accumulation precision variants."}
      },
      "expected_effects": [
        {"metric": "time_to_convergence_s", "direction": "decrease", "rationale": "May reduce dense operator latency when arithmetic intensity is high."},
        {"metric": "fallback_ratio", "direction": "increase", "rationale": "Aggressive device offload may increase fallback exposure for irregular cases."}
      ],
      "support_status": "systemc_configurable",
      "model_support_status": {
        "status": "configurable_systemc_model",
        "notes": "Can be represented through generated SystemC architecture config sidecars before stronger evidence is collected.",
        "supporting_artifact_refs": [
          "docs/benchmarks/template_to_systemc_config.py",
          "model/qe_band_solver_model/README.md"
        ]
      },
      "supported_evidence_tiers": ["survey-catalog", "projection-screened", "systemc-cycle-accounted"],
      "non_claims": [
        "not_a_final_best_winner_from_catalog",
        "not_rtl_cycle_accurate",
        "not_board_measured"
      ]
    },
    {
      "microarchitecture_id": "hbm_streaming_operator_pipeline",
      "name": "HBM streaming operator pipeline",
      "target_stage": "operator_sweep",
      "architecture_family": "F3",
      "summary": "Streaming memory-bandwidth-oriented pipeline hypothesis for operator application and vector movement pressure.",
      "provenance": [
        {
          "source_id": "template:f3_hbm_streaming_operator_pipeline_v1",
          "source_type": "local_design_template",
          "title": "F3 HBM streaming operator pipeline scaffold",
          "ref": "docs/architecture/architecture_templates/f3_hbm_streaming_operator_pipeline_v1.json",
          "notes": "Local scaffold for HBM/streaming projection semantics."
        }
      ],
      "assumptions": [
        "Workload vectors can be chunked into streams with bounded host-device synchronization.",
        "HBM effects are projection-only until a supported runtime and evidence artifacts exist."
      ],
      "parameter_ranges": {
        "stream_width_bytes": {"kind": "range", "min": 64, "max": 1024, "unit": "bytes", "description": "Projected stream width per beat."},
        "outstanding_streams": {"kind": "range", "min": 1, "max": 16, "unit": "streams", "description": "Candidate outstanding stream count."},
        "hbm_channel_count": {"kind": "unknown", "unknown_reason": "Board/platform not selected in Stage A", "description": "Physical HBM channel count requires later platform evidence."}
      },
      "expected_effects": [
        {"metric": "bytes_moved_to_convergence", "direction": "mixed", "rationale": "May reduce stalls but can increase explicit movement if residency is weak."},
        {"metric": "time_to_convergence_s", "direction": "decrease", "rationale": "May improve memory-bound operator phases when streaming is effective."}
      ],
      "support_status": "projection_only",
      "model_support_status": {
        "status": "projection_only",
        "notes": "Template metadata exists; no completed HBM runtime semantics are claimed.",
        "supporting_artifact_refs": ["docs/architecture/architecture_templates/f3_hbm_streaming_operator_pipeline_v1.json"]
      },
      "supported_evidence_tiers": ["survey-catalog", "projection-screened"],
      "non_claims": ["not_runtime_hbm_evidence", "not_board_measured", "not_final_best"]
    },
    {
      "microarchitecture_id": "cim_dsp_vector_hybrid",
      "name": "CIM + DSP vector hybrid",
      "target_stage": "multi_stage",
      "architecture_family": "F4",
      "summary": "Hybrid compute-in-memory plus DSP vector datapath hypothesis for mixed operator/build workloads.",
      "provenance": [
        {
          "source_id": "template:cim_dsp_vector_hybrid_v1",
          "source_type": "local_design_template",
          "title": "CIM + DSP vector hybrid scaffold",
          "ref": "docs/architecture/architecture_templates/cim_dsp_vector_hybrid_v1.json",
          "notes": "Projection scaffold for hybrid CIM/DSP partitioning."
        },
        {
          "source_id": "contract:cim_macro_block",
          "source_type": "local_contract",
          "title": "CIM macro block and timing contract",
          "ref": "docs/cim/cim_macro_block_and_timing_v0.md",
          "notes": "Contract informs CIM block assumptions but is not performance measurement."
        }
      ],
      "assumptions": [
        "CIM blocks are modeled as architectural resources, not measured macros.",
        "DSP fallback remains available for unsupported precision or sparsity cases."
      ],
      "parameter_ranges": {
        "cim_array_count": {"kind": "range", "min": 1, "max": 16, "unit": "arrays", "description": "Projection-only CIM array multiplicity."},
        "dsp_lane_count": {"kind": "range", "min": 8, "max": 256, "unit": "lanes", "description": "Projection-only DSP vector lane count."},
        "cim_precision_mode": {"kind": "enum", "values": ["fp64_proxy", "mixed_precision_proxy"], "description": "Claim-safe precision modes for projection."
        }
      },
      "expected_effects": [
        {"metric": "energy_to_convergence_j", "direction": "decrease", "rationale": "May reduce movement/energy if data residency assumptions hold."},
        {"metric": "spill_ratio", "direction": "mixed", "rationale": "Hybrid partition can either reduce spills or increase pressure if CIM capacity is insufficient."}
      ],
      "support_status": "projection_only",
      "model_support_status": {
        "status": "projection_only",
        "notes": "Hybrid semantics are proposal metadata pending executor support.",
        "supporting_artifact_refs": ["docs/architecture/architecture_templates/cim_dsp_vector_hybrid_v1.json"]
      },
      "supported_evidence_tiers": ["survey-catalog", "projection-screened"],
      "non_claims": ["not_cim_silicon_measurement", "not_rtl_timing", "not_final_best"]
    },
    {
      "microarchitecture_id": "near_memory_pim_resident_context",
      "name": "Near-memory PIM resident context",
      "target_stage": "memory_residency",
      "architecture_family": "custom",
      "summary": "Near-memory/PIM resident-context hypothesis for reducing repeated vector and subspace movement.",
      "provenance": [
        {
          "source_id": "template:custom_near_memory_pim_resident_v1",
          "source_type": "local_design_template",
          "title": "Near-memory PIM resident scaffold",
          "ref": "docs/architecture/architecture_templates/custom_near_memory_pim_resident_v1.json",
          "notes": "Local projection scaffold for resident/PIM behavior."
        },
        {
          "source_id": "contract:cim_resident_context",
          "source_type": "local_contract",
          "title": "Resident context and near-SRAM contract",
          "ref": "docs/cim/cim_resident_context_and_near_sram_contract_v0.md",
          "notes": "Used for residency assumptions only."
        }
      ],
      "assumptions": [
        "Resident context fits important subspace/vector state for selected workloads.",
        "PIM behavior is not supported by the current executor and must stay survey/projection-only."
      ],